Bluetooth monitor ver 5.66
= Note: Linux version 6.6.51+rpt-rpi-2712 (aarch64)                    0.361959
= Note: Bluetooth subsystem version 2.22                               0.361961
= New Index: 2C:CF:67:81:66:E3 (Primary,UART,hci0)              [hci0] 0.361962
= Open Index: 2C:CF:67:81:66:E3                                 [hci0] 0.361962
= Index Info: 2C:CF:67:81:66:E3 (Cypress Semiconductor)         [hci0] 0.361963
@ MGMT Open: bluetoothd (privileged) version 1.22             {0x0001} 0.361964
> ACL Data RX: Handle 64 flags 0x02 dlen 9                   #1 [hci0] 4.480332
      ATT: Write Request (0x12) len 4
        Handle: 0x0036
          Data: 0100
< ACL Data TX: Handle 64 flags 0x00 dlen 5                   #2 [hci0] 4.480681
      ATT: Write Response (0x13) len 0
> HCI Event: Number of Completed Packets (0x13) plen 5       #3 [hci0] 4.725979
        Num handles: 1
        Handle: 64
        Count: 1
> ACL Data RX: Handle 64 flags 0x02 dlen 251                 #4 [hci0] 9.797133
> ACL Data RX: Handle 64 flags 0x01 dlen 251                 #5 [hci0] 9.845885
> ACL Data RX: Handle 64 flags 0x01 dlen 7                   #6 [hci0] 9.845952
      ATT: Write Command (0x52) len 504
        Handle: 0x0038
          Data: 000000000000000000000000000000000000000000000000000000000000000000000000000000000000000000000000000000000000000000000000000000000000000000000000000000000000000000000000000000000000000000000000000000000000000000000000000000000000000000000000000000000000000000000000000000000000000000000000000000000000000000000000000000000000000000000000000000000000000000000000000000000000000000000000000000000000000000000000000000000000000000000000000000000000000000000000000000000000000000000000000000000000
> ACL Data RX: Handle 64 flags 0x02 dlen 251                #7 [hci0] 14.769656
> ACL Data RX: Handle 64 flags 0x01 dlen 251                #8 [hci0] 14.818402
> ACL Data RX: Handle 64 flags 0x01 dlen 7                  #9 [hci0] 14.818467
      ATT: Write Command (0x52) len 504
        Handle: 0x0038
          Data: 010101010101010101010101010101010101010101010101010101010101010101010101010101010101010101010101010101010101010101010101010101010101010101010101010101010101010101010101010101010101010101010101010101010101010101010101010101010101010101010101010101010101010101010101010101010101010101010101010101010101010101010101010101010101010101010101010101010101010101010101010101010101010101010101010101010101010101010101010101010101010101010101010101010101010101010101010101010101010101010101010101010101
> ACL Data RX: Handle 64 flags 0x02 dlen 251               #10 [hci0] 19.742198
> ACL Data RX: Handle 64 flags 0x01 dlen 251               #11 [hci0] 19.790947
> ACL Data RX: Handle 64 flags 0x01 dlen 7                 #12 [hci0] 19.791012
      ATT: Write Command (0x52) len 504
        Handle: 0x0038
          Data: 020202020202020202020202020202020202020202020202020202020202020202020202020202020202020202020202020202020202020202020202020202020202020202020202020202020202020202020202020202020202020202020202020202020202020202020202020202020202020202020202020202020202020202020202020202020202020202020202020202020202020202020202020202020202020202020202020202020202020202020202020202020202020202020202020202020202020202020202020202020202020202020202020202020202020202020202020202020202020202020202020202020202
> ACL Data RX: Handle 64 flags 0x02 dlen 251               #13 [hci0] 24.763497
> ACL Data RX: Handle 64 flags 0x01 dlen 251               #14 [hci0] 24.812243
> ACL Data RX: Handle 64 flags 0x01 dlen 7                 #15 [hci0] 24.812308
      ATT: Write Command (0x52) len 504
        Handle: 0x0038
          Data: 030303030303030303030303030303030303030303030303030303030303030303030303030303030303030303030303030303030303030303030303030303030303030303030303030303030303030303030303030303030303030303030303030303030303030303030303030303030303030303030303030303030303030303030303030303030303030303030303030303030303030303030303030303030303030303030303030303030303030303030303030303030303030303030303030303030303030303030303030303030303030303030303030303030303030303030303030303030303030303030303030303030303
> ACL Data RX: Handle 64 flags 0x02 dlen 251               #16 [hci0] 29.784792
> ACL Data RX: Handle 64 flags 0x01 dlen 251               #17 [hci0] 29.833537
> ACL Data RX: Handle 64 flags 0x01 dlen 7                 #18 [hci0] 29.833602
      ATT: Write Command (0x52) len 504
        Handle: 0x0038
          Data: 040404040404040404040404040404040404040404040404040404040404040404040404040404040404040404040404040404040404040404040404040404040404040404040404040404040404040404040404040404040404040404040404040404040404040404040404040404040404040404040404040404040404040404040404040404040404040404040404040404040404040404040404040404040404040404040404040404040404040404040404040404040404040404040404040404040404040404040404040404040404040404040404040404040404040404040404040404040404040404040404040404040404
> ACL Data RX: Handle 64 flags 0x02 dlen 9                 #19 [hci0] 30.610567
      ATT: Write Request (0x12) len 4
        Handle: 0x0036
          Data: 0000
< ACL Data TX: Handle 64 flags 0x00 dlen 5                 #20 [hci0] 30.610749
      ATT: Write Response (0x13) len 0
> HCI Event: Number of Completed Packets (0x13) plen 5     #21 [hci0] 30.851102
        Num handles: 1
        Handle: 64
        Count: 1
